{
  "$schema": "http://json-schema.org/draft-07/schema#",
  "$id": "post-admin-base-info.param.json",
  "title": "POST /admin/base-info request parameters",
  "description": "POST /admin/base-info request parameters の request parameter schema。ALPSの意味、be/var/fakeの観察値、Resource境界の実形状から導いたSemantic-Ex制約。",
  "type": "object",
  "properties": {
    "shopName": {
      "type": [
        "string",
        "null"
      ],
      "minLength": 0,
      "maxLength": 32,
      "title": "ショップ名（入力）",
      "description": "ショップの表示名。フロント画面のヘッダやメールに表示 Fake観察文字長 12〜12; 観察値 'EC-CUBE SHOP'。",
      "example": "EC-CUBE SHOP",
      "$comment": "Request schema is transport-level; business invalid values are allowed through to Resource/Semantic validation."
    },
    "shopKana": {
      "type": [
        "string",
        "null"
      ],
      "minLength": 0,
      "maxLength": 32,
      "title": "ショップ名フリガナ（入力）",
      "description": "ショップ名のカタカナ読み Fake観察文字長 12〜12; 観察値 'イーシーキューブショップ'。",
      "example": "イーシーキューブショップ",
      "$comment": "Request schema is transport-level; business invalid values are allowed through to Resource/Semantic validation."
    },
    "shopNameEng": {
      "type": [
        "string",
        "null"
      ],
      "minLength": 0,
      "maxLength": 32,
      "title": "ショップ名英語（入力）",
      "description": "ショップの英語名。多言語対応やメール署名等で使用 Fake観察文字長 12〜12; 観察値 'EC-CUBE SHOP'。",
      "example": "EC-CUBE SHOP",
      "$comment": "Request schema is transport-level; business invalid values are allowed through to Resource/Semantic validation."
    },
    "companyName": {
      "type": [
        "string",
        "null"
      ],
      "minLength": 0,
      "maxLength": 32,
      "title": "会社名（入力）",
      "description": "法人顧客の社名。B2B取引やインボイスで使用 Fake観察文字長 10〜11; 観察値 'Acme Corp.', '株式会社EC-CUBE'; null 24/32。",
      "example": "Acme Corp.",
      "$comment": "Request schema is transport-level; business invalid values are allowed through to Resource/Semantic validation."
    },
    "postalCode": {
      "title": "郵便番号（入力）",
      "description": "日本の郵便番号。ハイフンなし7桁またはハイフン付き8桁 日本の郵便番号。入力フォームではハイフン有無をどちらも受け入れる。 Fake観察文字長 7〜8; 観察値 '1500001', '1000005', '5300001', '530-0001'; null 18/33。",
      "type": [
        "string",
        "null"
      ],
      "example": "1500001",
      "$comment": "Request schema is transport-level; business invalid values are allowed through to Resource/Semantic validation."
    },
    "pref": {
      "title": "都道府県（入力）",
      "description": "日本の都道府県（1=北海道〜47=沖縄県）。住所の最上位区分として顧客・受注・配送先で使用。配送料の地域区分（DeliveryFee）や税率の地域設定（TaxRule）にも使用 都道府県ID。住所フォームの未選択状態では0、確定住所では1〜47を使う。 Fake観察数値 13〜27; 観察値 '13', '27'; null 3/9。",
      "type": [
        "integer",
        "null"
      ],
      "example": 13,
      "$comment": "Request schema is transport-level; business invalid values are allowed through to Resource/Semantic validation."
    },
    "addr01": {
      "type": [
        "string",
        "null"
      ],
      "minLength": 0,
      "maxLength": 32,
      "title": "市区町村（入力）",
      "description": "都道府県より下位の市区町村名 Fake観察文字長 3〜7; 観察値 '渋谷区', '千代田区', '大阪市北区', '大阪市北区梅田'; null 18/33。",
      "example": "渋谷区",
      "$comment": "Request schema is transport-level; business invalid values are allowed through to Resource/Semantic validation."
    },
    "addr02": {
      "type": [
        "string",
        "null"
      ],
      "minLength": 0,
      "maxLength": 32,
      "title": "番地・建物名（入力）",
      "description": "番地・ビル名・部屋番号等の詳細住所 Fake観察文字長 5〜8; 観察値 '神宮前1-1-1', '丸の内2-2-2', '梅田1-1-1', '1-2-3'; null 18/33。",
      "example": "神宮前1-1-1",
      "$comment": "Request schema is transport-level; business invalid values are allowed through to Resource/Semantic validation."
    },
    "phoneNumber": {
      "title": "電話番号（入力）",
      "description": "日本の電話番号形式（ハイフン区切り） 日本の電話番号。Fake corpusはハイフンなし中心だが、入力ではハイフン付きも許容する。 Fake観察文字長 10〜10; 観察値 '0312345678', '0901234567', '0612345678'; null 18/33。",
      "type": [
        "string",
        "null"
      ],
      "minLength": 0,
      "maxLength": 13,
      "example": "0312345678",
      "$comment": "Request schema is transport-level; business invalid values are allowed through to Resource/Semantic validation."
    },
    "businessHour": {
      "type": [
        "string",
        "null"
      ],
      "minLength": 0,
      "maxLength": 32,
      "title": "営業時間（入力）",
      "description": "ショップの営業時間。フリーフォーマット Fake観察文字長 11〜11; 観察値 '10:00-19:00'。",
      "example": "10:00-19:00",
      "$comment": "Request schema is transport-level; business invalid values are allowed through to Resource/Semantic validation."
    },
    "shopEmail01": {
      "title": "送信元/BCC メールアドレス（入力）",
      "description": "ほぼ全メール種別の送信元（From）兼ショップ控え（BCC）アドレス。注文確認・会員登録・パスワードリセット等で使用 Fake観察文字長 16〜16; 観察値 'shop@example.com'。",
      "type": [
        "string",
        "null"
      ],
      "minLength": 0,
      "maxLength": 254,
      "example": "shop@example.com",
      "$comment": "Request schema is transport-level; business invalid values are allowed through to Resource/Semantic validation."
    },
    "shopMessage": {
      "type": [
        "string",
        "null"
      ],
      "minLength": 0,
      "maxLength": 2000,
      "title": "ショップメッセージ（入力）",
      "description": "「当サイトについて」ページ（Help/about.twig）に表示する店舗からのメッセージ Fake観察文字長 20〜20; 観察値 'ようこそ、EC-CUBE SHOP へ。'。",
      "example": "ようこそ、EC-CUBE SHOP へ。",
      "$comment": "Request schema is transport-level; business invalid values are allowed through to Resource/Semantic validation."
    }
  },
  "additionalProperties": false,
  "$defs": {
    "productCode": {
      "title": "商品コード",
      "description": "SKU/品番。在庫管理や受注明細での識別に使用 SKUとして在庫・カート・受注明細を接続する。Fake観察ではASCII英数とハイフン中心。",
      "type": "string",
      "minLength": 1,
      "maxLength": 64,
      "pattern": "^[A-Za-z0-9][A-Za-z0-9._-]{0,63}$",
      "example": "sample-001"
    },
    "email": {
      "title": "メールアドレス",
      "description": "会員のログインIDを兼ねる。有効会員間で一意 ログインID/通知先として使うためRFC準拠のemail形式。",
      "type": "string",
      "format": "email",
      "minLength": 3,
      "maxLength": 254,
      "example": "alice@example.com"
    },
    "postalCode": {
      "title": "郵便番号",
      "description": "日本の郵便番号。ハイフンなし7桁またはハイフン付き8桁 日本国内住所向け。ハイフンなし7桁またはハイフン付き8桁。",
      "type": "string",
      "pattern": "^\\d{3}-?\\d{4}$",
      "example": "1500001"
    },
    "phoneNumber": {
      "title": "電話番号",
      "description": "日本の電話番号形式（ハイフン区切り） 日本国内電話番号。Fakeはハイフンなし中心、入力ではハイフン付きも許容。",
      "type": "string",
      "pattern": "^0\\d{1,4}-?\\d{1,4}-?\\d{3,4}$",
      "minLength": 10,
      "maxLength": 13,
      "example": "0312345678"
    },
    "price": {
      "title": "金額",
      "description": "EC-CUBEの商品価格・送料・手数料・売上金額。日本円の整数金額として扱う。",
      "type": "integer",
      "minimum": 0,
      "maximum": 999999999,
      "example": 1200
    },
    "quantity": {
      "title": "数量",
      "description": "購入数量。カート明細と受注明細で共通使用 購入/調整数量。入力は1以上、調整後や集計では0以上を許容する場合がある。",
      "type": "integer",
      "minimum": 1,
      "maximum": 999,
      "example": 2
    },
    "nonNegativeInteger": {
      "title": "非負整数",
      "description": "件数、在庫、ページ番号、集計値など0以上の整数。",
      "type": "integer",
      "minimum": 0,
      "maximum": 2147483647,
      "example": 1
    },
    "opaqueId": {
      "title": "不透明ID",
      "description": "BeMart/Fake/アプリ層で外部に公開する文字列ID。DB採番値としての数値演算には使わない。",
      "type": "string",
      "minLength": 1,
      "maxLength": 128,
      "pattern": "^[A-Za-z0-9._:@/-]+$",
      "example": "customer-001"
    },
    "dbId": {
      "title": "DB採番ID",
      "description": "EC-CUBEマスタや内部行を指す非負整数ID。表示やフォーム境界では文字列化される場合があるが、意味は採番ID。",
      "type": "integer",
      "minimum": 0,
      "maximum": 2147483647,
      "example": 1
    },
    "mixedBoundaryId": {
      "title": "互換境界ID",
      "description": "同一ResourceでFake文字列IDとEC-CUBE整数IDの両方が観察される互換境界専用ID。恒久的なドメイン型ではない。",
      "type": [
        "string",
        "integer"
      ],
      "minLength": 0,
      "maxLength": 128,
      "example": "pay-cod",
      "$comment": "mixedBoundaryIdは移行互換のための例外。可能ならopaqueIdまたはdbIdへ分解する。"
    },
    "pref": {
      "title": "都道府県ID",
      "description": "日本の都道府県（1=北海道〜47=沖縄県）。住所の最上位区分として顧客・受注・配送先で使用。配送料の地域区分（DeliveryFee）や税率の地域設定（TaxRule）にも使用 確定住所は1〜47。入力フォームの未選択初期値として0を許容する。",
      "type": "integer",
      "minimum": 0,
      "maximum": 47,
      "example": 13
    },
    "productStatus": {
      "title": "商品ステータス",
      "description": "1=公開（フロント表示）, 2=非公開（フロント非表示）, 3=廃止（論理削除、管理画面でもデフォルト非表示）",
      "type": "integer",
      "enum": [
        1,
        2,
        3
      ],
      "example": 1
    },
    "customerStatus": {
      "title": "会員ステータス",
      "description": "1=仮会員（メール未認証）, 2=本会員（認証済み）, 3=退会。退会時はメールアドレスが無効化される",
      "type": "integer",
      "enum": [
        1,
        2,
        3
      ],
      "example": 2
    },
    "orderStatus": {
      "title": "注文ステータス",
      "description": "1=新規受付, 3=注文取消, 4=対応中, 5=発送済み, 6=入金済み, 7=決済処理中, 8=購入処理中, 9=返品。Symfony Workflowステートマシンで遷移を制御。許可される遷移: pay(1->6), packing(1,6->4), cancel(1,4,6->3), back_to_in_progress(3->4), ship(1,6,4->5), return(5->9), cancel_return(9->5)。7と8はPurchaseFlow内で直接セットされステートマシン遷移の対象外 EC-CUBE受注状態。Fake/管理画面で扱う状態ID。",
      "type": "integer",
      "minimum": 1,
      "maximum": 9,
      "example": 1
    },
    "cartKey": {
      "title": "カートキー",
      "description": "カート分離キー。形式: {セッションプレフィックス}_{販売種別ID}。EC-CUBEは販売種別ごとにカートを分離するため、異なる販売種別の商品は別カートになる",
      "type": "string",
      "minLength": 3,
      "maxLength": 128,
      "pattern": "^.+_[0-9]+$",
      "example": "session-prefix-1_1"
    },
    "uriReference": {
      "title": "URI参照",
      "description": "画面遷移・リダイレクト・リンク先を表す相対または絶対URI。",
      "type": "string",
      "format": "uri-reference",
      "minLength": 1,
      "maxLength": 2048,
      "example": "/products"
    },
    "transitionId": {
      "title": "ALPS遷移ID",
      "description": "alps.json に定義された safe/unsafe descriptor のID。",
      "type": "string",
      "minLength": 2,
      "maxLength": 96,
      "pattern": "^(go|do)[A-Z][A-Za-z0-9]*$",
      "example": "doAddCartItem"
    },
    "date": {
      "title": "日付",
      "description": "業務上の日付。",
      "type": "string",
      "format": "date",
      "example": "2026-01-01"
    },
    "dateTime": {
      "title": "日時",
      "description": "業務イベント発生日時。",
      "type": "string",
      "format": "date-time",
      "example": "2026-01-01T00:00:00+09:00"
    },
    "link": {
      "title": "ハイパーメディアリンク",
      "description": "ALPS遷移に対応するリンク。hrefはURI参照。",
      "type": "object",
      "required": [
        "href"
      ],
      "additionalProperties": false,
      "properties": {
        "href": {
          "title": "URI参照",
          "description": "画面遷移・リダイレクト・リンク先を表す相対または絶対URI。",
          "type": "string",
          "format": "uri-reference",
          "minLength": 1,
          "maxLength": 2048,
          "example": "/products"
        },
        "rel": {
          "type": "string",
          "minLength": 1,
          "maxLength": 96
        },
        "method": {
          "type": "string",
          "enum": [
            "get",
            "post",
            "put",
            "patch",
            "delete",
            "GET",
            "POST",
            "PUT",
            "PATCH",
            "DELETE"
          ]
        }
      }
    }
  },
  "$comment": "Derived from ALPS meaning, be/var/fake observation, and Resource schema shape. Request schema is transport-level; business invalid values are allowed through to Resource/Semantic validation.",
  "required": [
    "shopName",
    "shopKana",
    "shopNameEng",
    "addr01",
    "businessHour",
    "shopEmail01",
    "shopMessage"
  ]
}
