{
  "shopName": "BeMart",
  "shopKana": "ビーマート",
  "shopNameEng": "BeMart",
  "companyName": "株式会社BeMart",
  "postalCode": "1010047",
  "pref": 13,
  "addr01": "東京都千代田区",
  "addr02": "神田1-1-1",
  "phoneNumber": "0312345678",
  "businessHour": "10:00-19:00",
  "shopEmail01": "shop@example.com",
  "shopMessage": "ようこそ、BeMart へ。"
}
